Pack Name,Release Date,Total TCG Score,Pack Score Average,Unlock Cards,Most Older Cards,Most Recent Cards
The Most Dangerous Race of the Cosmos!,2024-10-28,319320,7602.86,"Gold Pride - Eradicator, F.A. Dawn Dragster, Gold Pride - Star Leon, Gold Pride - Leon, F.A. Shining Star GT, Gold Pride - Better Luck Next Time!, Chicken Game, Gold Pride - Pin Baller, F.A. Motorhome Transport, F.A. Dark Dragster, Gold Pride - Eliminator, Gold Pride - Captain Carrie, Gold Pride - Chariot Carrie, Psychic Wheeleder, F.A. Auto Navigator, Gold Pride - The Crowd Goes Wild!, U.A. Hyper Stadium, U.A. Locker Room",Megamorph,Gold Pride - Eliminator
Sugar-Suffused Reverie,2024-11-07,267429,6685.73,"Madolche Queen Tiarafraise, Madolche Puddingcess Chocolat-a-la-Mode, Madolche Queen Tiaramisu, Madolche Teacher Glassouffle, Dreaming Nemleria, Sweet Dreams, Nemleria, Dreaming Reality of Nemleria, Realized, Nemleria Dream Devourer - Reveil, Madolche Puddingcess, Madolche Anjelly, Madolche Magileine, Madolche Messengelato, Madolche Petingcessoeur, Number 41: Bagooska the Terribly Tired Tapir, Madolche Hootcake, Madolche Mini Meowcaroons, Dream Tower of Princess Nemleria, Nemleria Repeter",Madolche Waltz,Madolche Dessert
Illusion Beast's Roar,2024-11-07,290359,7258.98,"Guardian Chimera, Darkest Diabolos, Lord of the Lair, Nightmare Magician, Nightmare Apprentice, Chimera the King of Phantom Beasts, Big-Winged Berfomet, Mirror Swordknight, Lilith, Lady of Lament, Chimera the Illusion Beast, Berfomet the Mythical King of Phantom Beasts, Cornfield Coatl, Gazelle the King of Mythical Claws, Ahrima, the Wicked Warden, Master Tao the Chanter, Alice, Lady of Lament, Loris, Lady of Lament, Chimera Fusion, Lair of Darkness, Deck Devastation Virus, Eradicator Epidemic Virus, Full Force Virus, Grinning Grave Virus",Gazelle the King of Mythical Beasts,Mirage Mirror Force
Geas of the Light,2024-11-07,679536,7994.54,"Vouiburial, the Dragon Undertaker, Flowering Etoile the Melodious Magnificat, Gandora-G the Dragon of Destruction, Snake-Eyes Diabellstar, Ultimate Flame Swordsman, Gandora-X the Dragon of Demolition, Bacha the Melodious Maestra, Nightmare Apprentice, Madolche Queen Tiarafraise, Refrain the Melodious Songstress, Heretical Phobos Covos, Shining Sarcophagus, Ostinato, Mirage Swordsman, Dark Magician the Magician of Black Magic, Couplet the Melodious Songstress, Fighting Flame Dragon, Fighting Flame Swordsman, Silent Magician Zero, Silent Swordsman Zero, Madolche Messengelato, Madolche Petingcessoeur, Salamandra, the Flying Flame Dragon, Courageous Crimson Chevalier Bradamante, Infernoble Knight - Renaud, Cosmic Tree Irmistil, Madolche Mini Meowcaroons, Bloom Harmonist the Melodious Composer, Ferocious Flame Swordsman, Fighting Flame Sword, Flame Swordsrealm, Turn Silence, ""Infernoble Arms - Almace"", 1st Movement Solo, Dark Magic Mirror Force",Madolche Mewfeuille,Madolche Dessert
Invincible Aces,2024-12-06,573266,6744.31,"Lord of the Heavenly Prison, Master Peace, the True Dracoslaying King, Red-Eyes Dark Dragoon, Red-Eyes Black Dragon, Girsu, the Orcust Mekk-Knight, Ghost Mourner & Moonlit Chill, Knightmare Gryphon, Mekk-Knight Crusadia Avramax, Knightmare Goblin, Knightmare Mermaid, Triple Tactics Thrust, Dark Ruler No More, Destructive Daruma Karma Cannon, Archfiend Black Skull Dragon, Mariamne, the True Dracophoenix, Metaltron XII, the True Dracombatant, True King Agnimazud, the Vanisher, True King Bahrastos, the Fathomer, True King Lithosagym, the Disaster, Fantastical Dragon Phantazmay, Red-Eyes Flare Metal Dragon, Red-Eyes Black Meteor Dragon, Dinomight Knight, the True Dracofighter, Ib the World Chalice Justiciar, Armageddon Knight, Draconnet, Longirsu, the Orcust Orchestrator, Galatea, the Orcust Automaton, Knightmare Cerberus, Knightmare Phoenix, Dragonic Diagram, Red-Eyes Fusion, Red-Eyes Insight, Orcust Crescendo, Warning Point",Red-Eyes Black Dragon,Red-Eyes Black Meteor Dragon
Chaotic Showtime,2024-12-06,671932,7905.08,"CXyz Gimmick Puppet Fanatix Machinix, Diabell, Queen of the White Forest, Gimmick Puppet Fantasix Machinix, Diabellze the Original Sinkeeper, Diabellstar the Black Witch, Gimmick Puppet Little Soldiers, Silvy of the White Forest, Astellar of the White Forest, Trickstar Hoody, Silhouhatte Rabbit, Trickstar Noble Angel, Tales of the White Forest, WANTED: Seeker of Sinful Spoils, Number C88: Gimmick Puppet Disaster Leo, Gimmick Puppet Rouge Doll, Gimmick Puppet Bisque Doll, Rciela, Sinister Soul of the White Forest, Silvera, Wolf Tamer of the White Forest, Trickstar Band Drummatis, Trickstar Corobane, Rucia of the White Forest, Trickstar Aqua Angel, Gimmick Puppet Gigantes Doll, Trickstar Lycoris, Vulmina, Statue of the Sacred Dragon, Elzette of the White Forest, Trickstar Foxglove Witch, Mansion of the Dreadful Dolls, Vesper Girsu, Silhouhatte Trick, Sinful Spoils Subdual, Woes of the White Forest, Apophis the Swamp Deity, Angel Statue - Azurune, Shapesister",Embodiment of Apophis,Trickstar Diffusion
